{
  "approval": null,
  "case_rules": {
    "derived_cases_are_not_external": "A case built from the current evidence set is not independent external validation, whatever it is labelled.",
    "development_and_holdout_disjoint": "DEVELOPMENT, INTERNAL_HOLDOUT and EXPERT_HOLDOUT are mutually exclusive (SAFETY-INV-009).",
    "legacy_and_demo_are_development": "Legacy manual hints and demo profiles are DEVELOPMENT or TRAINING only. They shaped the code that would be measured against them.",
    "no_expected_answers_in_blind_packets": "An exercise packet carries no expected answer, and no response may be generated from one.",
    "no_machine_curator": "A language model cannot serve as an independent scientific curator. There is no such role in CurationRole and none may be added without changing this protocol in the open.",
    "one_role_per_case": "A case holds exactly one role. Holding two would let a holdout result be reported as independent after informing development."
  },
  "content_hash": "sha256:e0a76f45b0f606e4fd76d4c31829fcd61825278b01e407b71c13fc38298b56d6",
  "expert_approved": false,
  "field_dictionary_version": "pgx-curation-field-dictionary/1",
  "generated_at": null,
  "note": "This protocol is not scientifically approved. Every vocabulary and definition in it is DRAFT / AWAITING EXPERT REVIEW until a named scientist records an approval against this content hash.",
  "protocol_version": "pgx-curation-protocol/1",
  "requirements": [
    {
      "checklist_item": "Does the record keep the source's own reported values apart from the curator's conclusion?",
      "implementation": "pgx.curation.models.SourceReportedValues; pgx.curation.models.CurationRecordDraft",
      "requirement_id": "CUR-PROT-001",
      "schema_field": "source_reported",
      "statement": "A curation record never writes into an evidence record, and never copies a source's reported value into its own conclusion field. Source-reported values are held in SourceReportedValues for comparison only.",
      "test_reference": "tests/unit/curation/test_curation_records.py::TestSourceAndConclusionStaySeparate",
      "title": "Source facts and curator conclusions are separate objects",
      "validation_code": "CUR_SOURCE_CONCLUSION_MERGED"
    },
    {
      "checklist_item": "Does the rationale explain the conclusion rather than repeat the source's significance flag?",
      "implementation": "pgx.curation.models.Rationale part 'significance_explanation'",
      "requirement_id": "CUR-PROT-002",
      "schema_field": "rationale.parts.significance_explanation",
      "statement": "significance=yes, a numeric score, a polarity or a recommendation flag reported by a source is never mapped directly to SUPPORTED, to confidence, to importance or to risk. The curator explains how the selected evidence supports the conclusion.",
      "test_reference": "tests/unit/curation/test_curation_records.py::TestSourceSignificanceIsNotAConclusion",
      "title": "Source significance does not become a conclusion",
      "validation_code": "CUR_SIGNIFICANCE_MAPPED_DIRECTLY"
    },
    {
      "checklist_item": "Is the exact question stated, including phenotype scope and effect dimension?",
      "implementation": "pgx.curation.models.CurationQuestion",
      "requirement_id": "CUR-PROT-003",
      "schema_field": "question",
      "statement": "The unit of curation is a question: gene, drug, phenotype scope, effect dimension and population context. A pair-level conclusion is not applied to every annotation sharing that gene and drug.",
      "test_reference": "tests/unit/curation/test_curation_records.py::TestCurationGranularity",
      "title": "A conclusion is recorded against an explicit question",
      "validation_code": "CUR_GRANULARITY_UNDEFINED"
    },
    {
      "checklist_item": "Does every conclusion cite real evidence record identifiers?",
      "implementation": "pgx.curation.models.CurationRecordDraft.__post_init__",
      "requirement_id": "CUR-PROT-004",
      "schema_field": "evidence",
      "statement": "A conclusion with no evidence has nothing to interpret and is refused at construction.",
      "test_reference": "tests/unit/curation/test_curation_records.py::TestEvidenceIsRequired",
      "title": "Every conclusion cites at least one evidence record",
      "validation_code": "CUR_EVIDENCE_MISSING"
    },
    {
      "checklist_item": "Is every exclusion given a controlled reason and a written rationale?",
      "implementation": "pgx.curation.models.EvidenceSelection",
      "requirement_id": "CUR-PROT-005",
      "schema_field": "evidence[].exclusion_reason",
      "statement": "Each cited record carries a relationship and a written rationale. An exclusion additionally carries a controlled ExclusionReason.",
      "test_reference": "tests/unit/curation/test_curation_records.py::TestExclusionsAreReasoned",
      "title": "Evidence inclusions and exclusions are both reasoned",
      "validation_code": "CUR_EXCLUSION_UNREASONED"
    },
    {
      "checklist_item": "Is contradicting evidence still present and assessed?",
      "implementation": "pgx.curation.models.CurationRecordDraft._check_conclusion_consistency",
      "requirement_id": "CUR-PROT-006",
      "schema_field": "evidence[].relationship",
      "statement": "Evidence that contradicts the conclusion stays in the record with relationship CONTRADICTS, and the conflict analysis must say something about it.",
      "test_reference": "tests/unit/curation/test_conflict_and_insufficiency.py::TestContradictoryEvidenceIsRetained",
      "title": "Contradictory evidence is retained, never dropped",
      "validation_code": "CUR_CONTRADICTION_HIDDEN"
    },
    {
      "checklist_item": "Has any source been preferred by rule rather than by argument?",
      "implementation": "pgx.curation.models.ConflictAnalysis (no precedence field exists)",
      "requirement_id": "CUR-PROT-007",
      "schema_field": "conflict",
      "statement": "There is no rule that CPIC, DPWG, a regulator label, a newer record or a higher source score wins. Which statement prevails is decided per disagreement by a named human.",
      "test_reference": "tests/unit/curation/test_conflict_and_insufficiency.py::TestNoSourcePrecedence",
      "title": "No source has precedence",
      "validation_code": "CUR_SOURCE_PRECEDENCE_ENCODED"
    },
    {
      "checklist_item": "Does an unresolved material conflict stop this conclusion reaching a rule?",
      "implementation": "pgx.curation.models.ConflictAnalysis.blocks_rule_construction",
      "requirement_id": "CUR-PROT-008",
      "schema_field": "conflict.blocks_rule_construction",
      "statement": "A conclusion whose conflict is UNRESOLVED, ADJUDICATION_REQUIRED, or PRESENT and material is not rule-eligible, and cannot be SUPPORTED.",
      "test_reference": "tests/unit/curation/test_conflict_and_insufficiency.py::TestUnresolvedConflictBlocksRules",
      "title": "Unresolved material conflict blocks rule construction",
      "validation_code": "CUR_CONFLICT_NOT_BLOCKING"
    },
    {
      "checklist_item": "Does the insufficient conclusion read as absence of knowledge rather than absence of risk?",
      "implementation": "pgx.curation.models.InsufficiencyStatement; pgx.curation.models.find_reassuring_language",
      "requirement_id": "CUR-PROT-009",
      "schema_field": "insufficiency",
      "statement": "An INSUFFICIENT conclusion states what is missing, what was reviewed, why nothing stronger holds and what remains unresolved. It may not read as low risk, no risk, no effect, safe, normal or negative evidence (SAFETY-INV-001).",
      "test_reference": "tests/unit/curation/test_conflict_and_insufficiency.py::TestInsufficientIsNotLowRisk",
      "title": "INSUFFICIENT is never reassurance",
      "validation_code": "CUR_INSUFFICIENT_AS_REASSURANCE"
    },
    {
      "checklist_item": "Does the rationale explain the reasoning rather than restate the answer?",
      "implementation": "pgx.curation.models.Rationale",
      "requirement_id": "CUR-PROT-010",
      "schema_field": "rationale.parts",
      "statement": "Eleven named parts, each substantive. 'Copied from legacy', 'MANUAL_EFFECT_HINTS says so', 'the score is high', 'the AI selected it', 'clinically known' and blank text are refused, and a rationale that restates the conclusion is refused as circular.",
      "test_reference": "tests/unit/curation/test_curation_records.py::TestRationaleContract",
      "title": "A CURATED conclusion requires a structured, non-placeholder rationale",
      "validation_code": "CUR_RATIONALE_PLACEHOLDER"
    },
    {
      "checklist_item": "Are the author and the independent reviewer different named people?",
      "implementation": "pgx.curation.models.Rationale.__post_init__",
      "requirement_id": "CUR-PROT-011",
      "schema_field": "rationale.reviewed_by",
      "statement": "The default protocol rule. One person checking their own conclusion is not an independent review, and CURATED requires both signatures.",
      "test_reference": "tests/unit/curation/test_roles_and_cases.py::TestAuthorReviewerSeparation",
      "title": "Author and independent reviewer are different people",
      "validation_code": "CUR_ROLE_SEPARATION_MISSING"
    },
    {
      "checklist_item": "Did a scientific role, held by a named person, approve this?",
      "implementation": "pgx.curation.vocabulary.SCIENTIFIC_APPROVAL_ROLES; pgx.curation.protocol.ROLE_DEFINITIONS",
      "requirement_id": "CUR-PROT-012",
      "schema_field": "roles[].may_approve_science",
      "statement": "Only SCIENTIFIC_CURATOR, INDEPENDENT_SCIENTIFIC_REVIEWER and ADJUDICATOR may approve science. There is no machine curator role.",
      "test_reference": "tests/unit/curation/test_roles_and_cases.py::TestOnlyScientificRolesApprove",
      "title": "An engineering role cannot approve scientific meaning",
      "validation_code": "CUR_ENGINEERING_APPROVAL"
    },
    {